<?xml version="1.0" encoding="UTF-8"?>

<!ELEMENT chat (message*)>

<!ELEMENT message (id, sender, receiver, text, data, ora)>

<!ELEMENT id (#PCDATA)>
<!ELEMENT sender (#PCDATA)>
<!ELEMENT receiver (#PCDATA)>
<!ELEMENT text (#PCDATA)>

<!ELEMENT data (giorno, mese, anno)>

<!ELEMENT giorno (#PCDATA)>

<!ELEMENT mese (#PCDATA)>

<!ELEMENT anno (#PCDATA)>

<!ELEMENT ora (#PCDATA)>
